{"format":"radarclip/1","map":"de_ancient","title":"Ancient R7, 20 s","round":7,"winner":"CT","tickrate":64,"start":2880,"step":8,"frames":161,"quant":{"xy":4,"z":8,"yaw":2},"focus":[3],"marks":[{"t":3821,"label":"kill"}],"places":["Outside","MainHall","BombsiteA","TSideUpper","Middle","SideHall","TopofMid","House","CTSpawn"],"weapons":["USP-S","knife","MP9","AK-47","M4A1-S","Five-SeveN","AWP"],"players":[{"name":"CT 1","side":"CT","track":{"alive":[0],"k":[0,7,6,6,4,1,1,1,2,3,1,1,1,1,3,3,7,3,4,5,1,11,1,2,1,2,2,4,9,5,7,7,3,4,9,2,5,2,4,2,9,6,2],"x":[-301,-50,-40,-25,-16,-3,3,5,12,19,8,7,4,-1,-8,-14,-23,-7,-6,-7,0,-7,-1,-2,-1,-1,0,2,-5,1,-12,-18,-10,0,-14,3,14,0,-5,-3,-6,-6,-1],"y":[-414,13,20,30,25,6,4,2,-4,-11,0,1,4,5,19,16,47,21,30,36,5,43,4,7,4,8,7,15,35,19,24,20,5,12,32,6,12,7,14,7,34,22,7],"z":[-4,1,-1,0,0,0,1,1,0,-1,0,0,0,0,1,0,0,2,9,0,0,0,0,0,0,0,0,0,0,1,0,-1,0,2,0,-1,-1,0,-1,-1,0,0,0],"yaw":[64,-9,-5,-3,-2,-10,-17,-10,-4,0,7,13,18,11,5,0,-4,-2,-2,0,0,0,5,22,0,-19,-6,0,6,0,0,-9,-3,-5,-12,1,0,-14,-4,9,4,-7,-11],"hp":[0,100],"armor":[0,0],"weapon":[0,0,29,1,30,0,36,2,63,0,66,2,73,0,76,2,80,0,84,2],"place":[0,0,57,1,127,2]}},{"name":"CT 2","side":"CT","track":{"alive":[0],"k":[0,7,4,2,3,3,1,1,1,3,3,2,2,4,2,2,2,2,3,5,2,2,5,4,3,3,2,1,1,3,1,3,3,1,1,4,1,1,3,2,6,1,2,3,4,1,2,5,6,6,9,2,5,7,3],"x":[-26,-6,-9,1,6,0,0,0,-1,-1,-5,-1,-6,-8,1,-4,7,10,7,-1,-1,-3,-18,-15,-11,-11,-8,-3,-2,-4,-4,-16,-7,-1,-3,-15,-3,-2,-8,0,0,0,2,1,2,-2,-3,-8,-17,-11,-32,-7,-14,-10,-10],"y":[-169,0,0,0,0,0,0,0,-2,-1,-6,-1,-5,-6,0,-1,4,4,5,-1,-2,-5,-8,-1,1,1,0,2,2,16,4,7,8,3,4,24,6,3,7,4,-2,0,0,2,11,3,7,15,16,22,0,-3,4,1,-1],"z":[20,0,0,0,0,0,0,0,0,0,0,0,0,1,0,0,0,-2,0,0,0,0,2,-1,-6,0,-4,-5,-1,0,0,0,0,0,0,1,0,1,0,1,-1,0,0,0,2,0,-1,1,1,1,2,0,1,0,0],"yaw":[-86,1,1,0,0,-1,-1,-10,-3,-1,-9,-2,-8,-3,-5,6,10,1,3,0,7,0,-6,-5,-3,-2,-3,0,-1,2,0,-5,0,-2,-14,-7,12,3,-4,-1,-5,4,17,1,1,9,4,4,2,8,-1,-3,-7,-3,-4],"hp":[0,100],"armor":[0,0],"weapon":[0,0],"place":[0,3,63,4,153,5]}},{"name":"CT 3","side":"CT","track":{"alive":[0,28],"k":[0,2,4,2,2,2,5,5,5],"x":[-382,-1,5,5,0,0,16,18,16],"y":[-33,7,13,3,1,4,2,1,4],"z":[13,0,0,0,0,0,0,0,0],"yaw":[24,-7,-2,0,0,12,16,7,4],"hp":[0,56],"armor":[0,89],"weapon":[0,3],"place":[0,5]}},{"name":"CT 4","side":"CT","track":{"alive":[0],"k":[0,4,1,1,1,1,1,2,2,2,1,1,1,1,2,2,2,1,2,2,3,1,5,5,7,9,12,8,5,4,3,4,10,5,2,3,5,2,4,4,10,3,3,4,2,2,3,2],"x":[-302,-29,-8,-5,0,3,4,10,12,5,5,3,2,2,7,5,0,-2,-2,0,0,0,-10,-17,-24,-33,-30,-22,-16,-14,-8,-2,1,7,2,-6,-2,-4,-15,-12,1,-4,5,1,0,-2,-12,-3],"y":[-280,3,-2,-3,-1,3,4,7,-4,-10,-2,3,5,6,5,-2,1,4,11,7,0,-2,-15,-6,-5,4,30,19,9,2,6,15,36,17,7,8,18,6,1,-5,1,-1,2,0,5,6,1,2],"z":[0,-1,0,0,0,0,0,1,0,-1,0,1,1,0,0,0,0,1,3,0,0,0,-3,-1,-2,1,1,-2,3,0,3,4,0,0,0,0,0,1,0,0,0,0,0,0,0,0,0,0],"yaw":[-68,7,21,1,1,7,17,-1,-15,-6,-13,-21,0,-13,1,-2,-1,-8,1,2,1,5,-5,-5,-13,-14,-3,-3,-4,-3,-1,-1,1,16,1,4,4,0,-5,-10,0,-3,3,0,0,-4,-7,3],"hp":[0,2],"armor":[0,79],"weapon":[0,0,26,4],"place":[0,0,101,1]}},{"name":"CT 5","side":"CT","track":{"alive":[0],"k":[0,7,2,1,3,1,4,8,3,2,1,2,1,4,2,2,1,2,3,4,2,2,2,7,1,4,2,2,2,4,1,2,3,2,1,7,1,1,1,3,4,2,2,1,2,1,6,4,4,7,4,7,9,4],"x":[-182,-47,-14,-8,-21,-4,-12,-12,-2,-3,-2,2,-1,-18,7,12,5,7,1,-11,-1,0,5,12,3,0,-1,5,7,12,1,5,8,6,0,0,0,1,3,18,24,6,2,0,2,2,20,14,12,9,3,3,-1,6],"y":[-67,22,3,1,5,2,9,28,-3,-6,0,7,-1,7,0,0,-4,-7,-1,14,0,0,-5,-22,-2,0,-5,-8,-3,2,1,3,3,0,0,-1,0,-2,-2,0,3,0,0,0,0,-1,1,0,6,22,14,24,31,12],"z":[8,4,0,1,0,0,0,0,0,0,0,0,0,0,0,0,0,0,0,0,0,0,0,0,0,0,0,0,0,0,0,0,0,-1,0,-1,0,1,0,-1,-2,0,-1,0,0,0,-1,0,1,6,0,6,0,0],"yaw":[77,10,2,-1,-16,0,3,7,0,-7,-4,1,0,-28,2,10,14,5,6,5,2,-1,-8,-15,-1,1,-1,0,-1,7,-3,-37,-1,-14,-2,3,5,18,17,25,2,0,0,-3,-41,-8,-3,5,5,3,0,3,0,1],"hp":[0,95],"armor":[0,0],"weapon":[0,5,66,3],"place":[0,4,12,5,88,4,137,6,160,7]}},{"name":"T 1","side":"T","track":{"alive":[],"k":[],"x":[],"y":[],"z":[],"yaw":[],"hp":[],"armor":[],"weapon":[],"place":[]}},{"name":"T 2","side":"T","track":{"alive":[],"k":[],"x":[],"y":[],"z":[],"yaw":[],"hp":[],"armor":[],"weapon":[],"place":[]}},{"name":"T 3","side":"T","track":{"alive":[],"k":[],"x":[],"y":[],"z":[],"yaw":[],"hp":[],"armor":[],"weapon":[],"place":[]}},{"name":"T 4","side":"T","track":{"alive":[],"k":[],"x":[],"y":[],"z":[],"yaw":[],"hp":[],"armor":[],"weapon":[],"place":[]}},{"name":"T 5","side":"T","track":{"alive":[0],"k":[0,30,1,1,1,1,1,1,2,1,8,1,1,1,1,10,7,8,3,5,8,8,4,4,3,3,2,4,3,3,2,5,10,11,6],"x":[-400,0,0,0,0,0,0,0,2,2,24,3,3,3,2,17,20,24,9,16,25,24,10,13,9,8,4,-1,9,7,6,14,32,31,16],"y":[271,4,1,1,3,4,3,2,2,1,2,1,1,1,3,27,11,9,3,4,2,-5,-8,-4,4,0,6,-3,1,-6,-1,-6,-6,-18,-9],"z":[7,-1,0,0,0,0,1,5,1,-1,0,0,1,0,0,0,-1,1,-4,0,0,0,0,0,0,0,0,0,0,-3,-2,-1,1,1,2],"yaw":[-37,0,2,24,8,1,9,-1,2,0,16,9,1,-14,-6,-13,-1,-2,-1,-1,-2,-1,4,-2,-8,-1,-3,-3,-3,-1,-1,0,-6,-8,-10],"hp":[0,100],"armor":[0,100],"weapon":[0,6],"place":[0,2,104,8]}}],"events":[{"type":"kill","t":1203,"attacker":2,"victim":8,"weapon":"fiveseven","hs":false,"x":-528,"y":-649,"z":32},{"type":"kill","t":1515,"attacker":2,"victim":5,"weapon":"fiveseven","hs":true,"x":-649,"y":-431,"z":45},{"type":"kill","t":2494,"attacker":2,"victim":7,"weapon":"ak47","hs":true,"x":-1360,"y":197,"z":88},{"type":"kill","t":2704,"attacker":3,"victim":6,"weapon":"mp9","hs":false,"x":-1211,"y":-1053,"z":12},{"type":"hurt","t":3103,"attacker":9,"victim":2,"dmg":109,"weapon":"awp"},{"type":"kill","t":3103,"attacker":9,"victim":2,"weapon":"awp","hs":false,"x":-1288,"y":16,"z":103,"assister":7}],"nades":[{"type":"he","by":6,"path":[2880,-801,-785,51,4,0,0,0,4,0,0,0,4,0,0,0,4,0,0,0,4,0,0,0,4,0,0,0,4,0,0,0,4,0,0,0,4,0,0,0,4,0,0,0,4,0,0,0,4,0,0,0,4,0,0,0,4,0,0,0,4,0,0,0,4,0,0,0,4,0,0,0,4,0,0,0,4,0,0,0,4,0,0,0,4,0,0,0,4,0,0,0,4,0,0,0,4,0,0,0,4,0,0,0,4,0,0,0,4,0,0,0,4,0,0,0,3,0,0,0]}],"shots":{"t":[3103],"p":[9],"yaw":[-75]}}